{
  "addressLine1": "minim exercitation anim",
  "contactPointType": [
    "reprehenderit"
  ],
  "id": "minim culpa Duis eu dolor",
  "activeFromDate": "1946-08-14",
  "cityName": "proident ullamco ex",
  "geoLatitude": null,
  "party": [
    "in"
  ],
  "addressLine2": "minim nulla amet nisi",
  "primaryFlag": null,
  "geoLongitude": -41602494,
  "bestTimeToContactEndTime": "00:00:01",
  "isUsedForBilling": null,
  "stateProvinceName": "ut ex irure eu qui",
  "bestTimeToContactStartTime": "00:00:01",
  "postalCodeText": "et"
}
